特許出願技術動向調査分析費（事務費）,完全一致,3919,特許出願技術動向調査分析費（事務費）,1.0,True,True
ポスト５Ｇ情報通信システム基盤強化研究開発事業（AI基盤モデル及び先端半導体関連技術開発事業）,完全一致,3522,ポスト５Ｇ情報通信システム基盤強化研究開発事業（AI基盤モデル及び先端半導体関連技術開発事業）,1.0,True,True
研究データの公開基盤となる機関リポジトリの構築及び運用事業,完全一致,3104,研究データの公開基盤となる機関リポジトリの構築及び運用事業,1.0,True,False
独立行政法人労働政策研究・研修機構運営費,完全一致,2989,独立行政法人労働政策研究・研修機構運営費,1.0,True,True
地域情報化の推進（本省）,完全一致,730,地域情報化の推進（本省）,1.0,True,True
地域情報化の推進（地方）（令和７年度要求では、地域情報化の推進）,完全一致,737,地域情報化の推進（地方）（令和７年度要求では、地域情報化の推進）,1.0,True,True
大学等における価値創造人材育成拠点の形成,完全一致,1460,大学等における価値創造人材育成拠点の形成,1.0,True,True
宇宙・航空科学技術推進の調整に必要な経費,完全一致,1703,宇宙・航空科学技術推進の調整に必要な経費,1.0,True,True
データ創出・活用型マテリアル研究開発プロジェクト,完全一致,1887,データ創出・活用型マテリアル研究開発プロジェクト,1.0,True,True
みどりの食料システム戦略実現技術開発・実証事業のうちスマート農業の総合推進対策,完全一致,3498,みどりの食料システム戦略実現技術開発・実証事業のうちスマート農業の総合推進対策,1.0,True,True
生鮮食料品等サプライチェーン緊急強化対策事業,完全一致,6891,生鮮食料品等サプライチェーン緊急強化対策事業,1.0,True,True
緊急食糧支援事業（令和６年度は食料安全保障確立対策費のうち緊急食糧支援事業費補助金及びアセアン＋３緊急米備蓄理事会会合開催経費）,完全一致,3207,緊急食糧支援事業（令和６年度は食料安全保障確立対策費のうち緊急食糧支援事業費補助金及びアセアン＋３緊急米備蓄理事会会合開催経費）,1.0,True,False
みどりの食料システム戦略実現技術開発・実証事業のうち農林水産研究の推進,完全一致,3496,みどりの食料システム戦略実現技術開発・実証事業のうち農林水産研究の推進,1.0,True,True
国立研究開発法人農業・食品産業技術総合研究機構に要する経費,完全一致,3320,国立研究開発法人農業・食品産業技術総合研究機構に要する経費,1.0,True,True
電磁波領域等を活用した将来の戦闘概念に関する調査・研究に必要な経費,完全一致,5408,電磁波領域等を活用した将来の戦闘概念に関する調査・研究に必要な経費,1.0,True,True
取締機器等調査研究経費,完全一致,1379,取締機器等調査研究経費,1.0,True,True
国際機関分担金（IAIS）,完全一致,446,国際機関分担金（IAIS）,1.0,True,False
国土交通分野のデータ整備・活用・オープンデータ化プロジェクト（Project LINKS）,ファジーマッチ,7452,国土交通分野のデータ整備・活用・オープンデータ化プロジェクト（Project  LINKS）,0.989010989010989,True,True
防災・減災のためのリモートセンシング技術による高精度データの収集・分析・配信技術の開発及び基盤の整備 （令和５年度第一次補正においてはリモートセンシング技術のユーザー最適型データ提供に関する研究開発）,ファジーマッチ,844,防災・減災のためのリモートセンシング技術による高精度データの収集・分析・配信技術の開発及び基盤の整備／（令和５年度第一次補正においてはリモートセンシング技術のユーザー最適型データ提供に関する研究開発）,0.99,True,True
サイバーセキュリティ統合知的・人材育成基盤の構築 （令和５年度第一次補正においては実践的サイバーセキュリティ人材育成の拡充）,ファジーマッチ,729,サイバーセキュリティ統合知的・人材育成基盤の構築／（令和５年度第一次補正においては実践的サイバーセキュリティ人材育成の拡充）,0.9838709677419355,True,True
