公式事業名,マッチタイプ,事業ID,マッチした事業名,類似度,改善検索に含まれる,基本形スプレッドシートに含まれる
新興国に対する技術協力に必要な経費,完全一致,441,新興国に対する技術協力に必要な経費,1.0,True,False
総務省における生成AI利用環境（情報通信技術調達等適正・効率化推進費）,完全一致,20310,総務省における生成AI利用環境（情報通信技術調達等適正・効率化推進費）,1.0,True,True
オンライン研修システム（情報通信技術調達等適正・効率化推進費）,完全一致,6553,オンライン研修システム（情報通信技術調達等適正・効率化推進費）,1.0,True,True
デジタル臨時行政調査会事務局の運営等経費,完全一致,5421,デジタル臨時行政調査会事務局の運営等経費,1.0,True,True
情報システム統一研修運営費,完全一致,696,情報システム統一研修運営費,1.0,True,True
スマートライフ実現のためのＡＩシミュレーション,完全一致,43,スマートライフ実現のためのＡＩシミュレーション,1.0,True,True
ＡＩの安全性確保に資する取組の推進,完全一致,20509,ＡＩの安全性確保に資する取組の推進,1.0,True,True
沖縄域外競争力強化促進事業,完全一致,190,沖縄域外競争力強化促進事業,1.0,True,True
個人情報の適正な取扱いに関する国際協力に必要な経費,完全一致,315,個人情報の適正な取扱いに関する国際協力に必要な経費,1.0,True,True
地域少子化対策強化事業,完全一致,6474,地域少子化対策強化事業,1.0,True,True
生成ＡＩの検証環境（情報通信技術調達等適正・効率化推進費）,完全一致,7632,生成ＡＩの検証環境（情報通信技術調達等適正・効率化推進費）,1.0,True,True
テクノロジーマップ整備推進ウェブサイト（情報通信技術調達等適正・効率化推進費）,完全一致,6574,テクノロジーマップ整備推進ウェブサイト（情報通信技術調達等適正・効率化推進費）,1.0,True,True
政府によるAI 調達・利活用等調査事業,完全一致,20837,政府によるAI 調達・利活用等調査事業,1.0,True,True
IAIS会合開催に必要な経費,完全一致,452,IAIS会合開催に必要な経費,1.0,True,False
金融仲介機能の強化,完全一致,423,金融仲介機能の強化,1.0,True,True
自動車リサイクルにおける再生材利用拡大に向けた産官学連携推進事業,完全一致,7624,自動車リサイクルにおける再生材利用拡大に向けた産官学連携推進事業,1.0,True,True
金融犯罪及びマネーロンダリング等対策強化事業,完全一致,20008,金融犯罪及びマネーロンダリング等対策強化事業,1.0,True,True
サイバーセキュリティ対策等事業費,完全一致,5559,サイバーセキュリティ対策等事業費,1.0,True,True
こども政策DXの実現に向けた実証事業,完全一致,6535,こども政策DXの実現に向けた実証事業,1.0,True,True
無人戦闘車両システムの研究,完全一致,7576,無人戦闘車両システムの研究,1.0,True,True
サイバー攻撃対処能力向上に関する経費,完全一致,7499,サイバー攻撃対処能力向上に関する経費,1.0,True,True
ＡＩ導入推進に関する経費,完全一致,5305,ＡＩ導入推進に関する経費,1.0,True,True
大規模言語モデルの活用に向けた検討・構築の経費,完全一致,20478,大規模言語モデルの活用に向けた検討・構築の経費,1.0,True,True
AI適用システム維持管理のための環境構築の実証に関する経費,完全一致,5924,AI適用システム維持管理のための環境構築の実証に関する経費,1.0,True,True
森林技術国際展開支援事業,完全一致,3365,森林技術国際展開支援事業,1.0,True,True
食品産業の国際競争力強化緊急対策事業,完全一致,5898,食品産業の国際競争力強化緊急対策事業,1.0,True,True
海洋生物ビッグデータ活用技術高度化,完全一致,1890,海洋生物ビッグデータ活用技術高度化,1.0,True,True
地方やデジタル分野における専修学校理系転換等推進事業,完全一致,6786,地方やデジタル分野における専修学校理系転換等推進事業,1.0,True,True
人文学・社会科学のDX化に向けた研究開発推進事業,完全一致,6798,人文学・社会科学のDX化に向けた研究開発推進事業,1.0,True,True
生成AIモデルの透明性・信頼性の確保に向けた研究開発拠点形成,完全一致,6799,生成AIモデルの透明性・信頼性の確保に向けた研究開発拠点形成,1.0,True,True
ＡＩを活用した海賊版サイトの検知システム（情報通信技術調達等適正・効率化推進費）,完全一致,20981,ＡＩを活用した海賊版サイトの検知システム（情報通信技術調達等適正・効率化推進費）,1.0,True,True
次世代の学校・教育現場を見据えた先端技術・教育データの利活用推進,完全一致,6821,次世代の学校・教育現場を見据えた先端技術・教育データの利活用推進,1.0,True,True
小・中・高等学校を通じた英語教育強化事業,完全一致,1491,小・中・高等学校を通じた英語教育強化事業,1.0,True,True
ナノテクノロジー・材料研究開発推進経費,完全一致,5794,ナノテクノロジー・材料研究開発推進経費,1.0,True,True
マテリアル先端リサーチインフラ,完全一致,1671,マテリアル先端リサーチインフラ,1.0,True,True
半導体人材育成拠点形成事業（「半導体人材育成拠点形成のための設備整備事業」を含む）,完全一致,20282,半導体人材育成拠点形成事業（「半導体人材育成拠点形成のための設備整備事業」を含む）,1.0,True,True
デジタルと掛けるダブルメジャー大学院教育構築事業,完全一致,1908,デジタルと掛けるダブルメジャー大学院教育構築事業,1.0,True,True
外国政府派遣留学生の予備教育等留学生受入促進事業,完全一致,1853,外国政府派遣留学生の予備教育等留学生受入促進事業,1.0,True,False
日本台湾交流協会,完全一致,1854,日本台湾交流協会,1.0,True,False
日本留学促進のための海外ネットワーク機能強化事業,完全一致,1855,日本留学促進のための海外ネットワーク機能強化事業,1.0,True,False
大学の世界展開力強化事業,完全一致,1577,大学の世界展開力強化事業,1.0,True,False
保健医療分野におけるAI研究開発加速に向けた人材養成産学協働プロジェクト,完全一致,1559,保健医療分野におけるAI研究開発加速に向けた人材養成産学協働プロジェクト,1.0,True,True
地震防災研究戦略プロジェクト,完全一致,1692,地震防災研究戦略プロジェクト,1.0,True,True
図書館における障害者利用の促進,完全一致,1468,図書館における障害者利用の促進,1.0,True,False
国家戦略分野の若手研究者及び博士後期課程学生の育成（次世代 AI 人材育成プログラム）,完全一致,6797,国家戦略分野の若手研究者及び博士後期課程学生の育成（次世代 AI 人材育成プログラム）,1.0,True,True
データ関連人材育成プログラム,完全一致,6833,データ関連人材育成プログラム,1.0,True,True
次世代エッジAI半導体・フィジカルインテリジェンスの統合的研究開発,完全一致,20401,次世代エッジAI半導体・フィジカルインテリジェンスの統合的研究開発,1.0,True,True
国語施策の充実,完全一致,1804,国語施策の充実,1.0,True,True
AIP:人工知能/ビッグデータ/IoT/サイバーセキュリティ統合プロジェクト（次世代人工知能技術等研究開発拠点形成事業費補助金）,完全一致,1666,AIP:人工知能/ビッグデータ/IoT/サイバーセキュリティ統合プロジェクト（次世代人工知能技術等研究開発拠点形成事業費補助金）,1.0,True,True
統計エキスパート人材育成プロジェクト,完全一致,1886,統計エキスパート人材育成プロジェクト,1.0,True,True
AI等の活用を推進する研究データエコシステム構築事業,完全一致,1913,AI等の活用を推進する研究データエコシステム構築事業,1.0,True,True
革新的ハイパフォーマンス・コンピューティング・インフラ（ＨＰＣＩ）の構築,完全一致,1658,革新的ハイパフォーマンス・コンピューティング・インフラ（ＨＰＣＩ）の構築,1.0,True,True
WWL(ワールド・ワイド・ラーニング）コンソーシアム構築支援事業,完全一致,1494,WWL(ワールド・ワイド・ラーニング）コンソーシアム構築支援事業,1.0,True,True
次世代の校務デジタル化推進実証事業,完全一致,6777,次世代の校務デジタル化推進実証事業,1.0,True,True
システム検証・監査及びインシデント対応等事業費（情報通信技術調達等適正・効率化推進費）,完全一致,6560,システム検証・監査及びインシデント対応等事業費（情報通信技術調達等適正・効率化推進費）,1.0,True,True
交通AIの技術革新とガバナンス制度に関する調査研究,完全一致,7433,交通AIの技術革新とガバナンス制度に関する調査研究,1.0,True,True
AIターミナル高度化実証事業,完全一致,4227,AIターミナル高度化実証事業,1.0,True,True
新技術を活用した都市の緑の効率的な計測手法及び評価手法に関する研究,完全一致,7450,新技術を活用した都市の緑の効率的な計測手法及び評価手法に関する研究,1.0,True,True
新モビリティサービス推進事業,完全一致,4340,新モビリティサービス推進事業,1.0,True,True
国土数値情報の整備,完全一致,4455,国土数値情報の整備,1.0,True,True
地理空間情報の流通・利用促進の検討,完全一致,4465,地理空間情報の流通・利用促進の検討,1.0,True,False
都市空間情報デジタル基盤構築支援事業、都市空間情報デジタル基盤構築調査及び先導的まちづくり調査,完全一致,4642,都市空間情報デジタル基盤構築支援事業、都市空間情報デジタル基盤構築調査及び先導的まちづくり調査,1.0,True,True
AIの高度化に応じたガバナンスに関する調査研究,完全一致,20137,AIの高度化に応じたガバナンスに関する調査研究,1.0,True,True
AIによるGX・DXの進展等に対応するためのデジタルインフラの在り方に関する調査研究,完全一致,20294,AIによるGX・DXの進展等に対応するためのデジタルインフラの在り方に関する調査研究,1.0,True,True
多国間枠組におけるデータ流通等に係る連携強化事業,完全一致,874,多国間枠組におけるデータ流通等に係る連携強化事業,1.0,True,True
多言語翻訳技術の高度化に関する研究開発,完全一致,727,多言語翻訳技術の高度化に関する研究開発,1.0,True,True
デジタル・シティズンシップの総合的な推進事業（令和6年度から、 幅広い世代を対象としたICT活用のためのリテラシー向上推進事業（本省））,完全一致,5628,デジタル・シティズンシップの総合的な推進事業（令和6年度から、 幅広い世代を対象としたICT活用のためのリテラシー向上推進事業（本省））,1.0,True,True
幅広い世代を対象としたICT活用のためのリテラシー向上推進事業（地方）,完全一致,6621,幅広い世代を対象としたICT活用のためのリテラシー向上推進事業（地方）,1.0,True,True
AIに関する継続的な国際的ルールの形成への貢献,完全一致,7758,AIに関する継続的な国際的ルールの形成への貢献,1.0,True,True
グリーン社会に資する先端光伝送技術の研究開発,完全一致,867,グリーン社会に資する先端光伝送技術の研究開発,1.0,True,True
G7デジタル・技術大臣会合開催経費,完全一致,5625,G7デジタル・技術大臣会合開催経費,1.0,True,True
我が国における大規模言語モデル（LLM）の開発力強化に向けたデータの整備･拡充及びリスク対応力強化（令和６年度補正・令和７年度要求では、我が国における大規模言語モデル（LLM）の開発力強化に向けたデータの整備･拡充）,完全一致,7755,我が国における大規模言語モデル（LLM）の開発力強化に向けたデータの整備･拡充及びリスク対応力強化（令和６年度補正・令和７年度要求では、我が国における大規模言語モデル（LLM）の開発力強化に向けたデータの整備･拡充）,1.0,True,True
オール光ネットワーク技術開発の促進及び普及・拡大,完全一致,20138,オール光ネットワーク技術開発の促進及び普及・拡大,1.0,True,True
海外展開に資する高品質コンテンツ製作促進事業,完全一致,20048,海外展開に資する高品質コンテンツ製作促進事業,1.0,True,True
インターネット上の偽・誤情報等への総合的対策の推進,完全一致,20232,インターネット上の偽・誤情報等への総合的対策の推進,1.0,True,True
地域社会DX推進パッケージ事業,完全一致,20495,地域社会DX推進パッケージ事業,1.0,True,True
通信・放送分野における情報バリアフリー促進支援事業　（令和５年度第一次補正においては情報アクセシビリティ支援ナビ（Act-navi）の大規模機能強化事業、令和６年度補正・令和７年度要求では、アクセシブルなICT機器等の総合的な開発普及推進事業）,完全一致,731,通信・放送分野における情報バリアフリー促進支援事業　（令和５年度第一次補正においては情報アクセシビリティ支援ナビ（Act-navi）の大規模機能強化事業、令和６年度補正・令和７年度要求では、アクセシブルなICT機器等の総合的な開発普及推進事業）,1.0,True,True
生成AI等を活用したサイバーセキュリティ対策強化,完全一致,20297,生成AI等を活用したサイバーセキュリティ対策強化,1.0,True,True
地方公共団体における消防防災体制の充実強化,完全一致,842,地方公共団体における消防防災体制の充実強化,1.0,True,True
雇用関係助成金DX化に係る調査研究事業,完全一致,20597,雇用関係助成金DX化に係る調査研究事業,1.0,True,True
デジタル人材育成のための「実践の場」開拓モデル事業,完全一致,7736,デジタル人材育成のための「実践の場」開拓モデル事業,1.0,True,True
大規模実証事業に必要な経費（（項）介護保険制度運営推進費）,完全一致,2865,大規模実証事業に必要な経費（（項）介護保険制度運営推進費）,1.0,True,True
医薬品等規制行政に直結する政策研究費,完全一致,2906,医薬品等規制行政に直結する政策研究費,1.0,True,True
生物学的製剤の安全性情報収集、解析、評価に係る研究事業費,完全一致,2934,生物学的製剤の安全性情報収集、解析、評価に係る研究事業費,1.0,True,True
世界保健機関等拠出金,完全一致,2875,世界保健機関等拠出金,1.0,True,False
国立研究開発法人医薬基盤・健康・栄養研究所運営費交付金,完全一致,2965,国立研究開発法人医薬基盤・健康・栄養研究所運営費交付金,1.0,True,True
気候変動対策に係る国際会議の開催等によるエネルギー・環境技術イノベーション創出のための国際連携推進事業委託費（旧：地球温暖化対策における国際機関等連携事業委託費）,完全一致,3832,気候変動対策に係る国際会議の開催等によるエネルギー・環境技術イノベーション創出のための国際連携推進事業委託費（旧：地球温暖化対策における国際機関等連携事業委託費）,1.0,True,True
保安規制高度化等事業（うち新エネルギー等の保安規制高度化事業）,完全一致,3763,保安規制高度化等事業（うち新エネルギー等の保安規制高度化事業）,1.0,True,True
省エネ半導体関連開発事業（うち高効率・高速処理を可能とする次世代コンピューティングの技術開発事業）,完全一致,5943,省エネ半導体関連開発事業（うち高効率・高速処理を可能とする次世代コンピューティングの技術開発事業）,1.0,True,True
重要技術総合管理事業,完全一致,7091,重要技術総合管理事業,1.0,True,True
省エネ半導体関連開発事業（うち省エネAI半導体及びシステムに関する技術開発事業）,完全一致,5854,省エネ半導体関連開発事業（うち省エネAI半導体及びシステムに関する技術開発事業）,1.0,True,True
成長志向型の資源自律経済加速化事業（うち資源自律経済システム開発促進事業）,完全一致,5863,成長志向型の資源自律経済加速化事業（うち資源自律経済システム開発促進事業）,1.0,True,True
工業所有権研究等委託費（先端技術等による特許庁業務改革調査事業）,完全一致,3988,工業所有権研究等委託費（先端技術等による特許庁業務改革調査事業）,1.0,True,True
イノベーション創出のためのフロンティア育成・基盤構築事業（うちデジタル・ロボットシステム技術基盤構築事業）,完全一致,19862,イノベーション創出のためのフロンティア育成・基盤構築事業（うちデジタル・ロボットシステム技術基盤構築事業）,1.0,True,True
チップレット設計基盤構築に向けた技術開発事業,完全一致,5853,チップレット設計基盤構築に向けた技術開発事業,1.0,True,True
質の高いインフラの海外展開に向けた事業実施可能性調査等事業,完全一致,3615,質の高いインフラの海外展開に向けた事業実施可能性調査等事業,1.0,True,True
デジタル基盤整備事業（うち地域デジタル人材育成・確保推進事業）,完全一致,19883,デジタル基盤整備事業（うち地域デジタル人材育成・確保推進事業）,1.0,True,True
IoT社会実現に向けた次世代人工知能・センシング等中核技術開発,完全一致,3510,IoT社会実現に向けた次世代人工知能・センシング等中核技術開発,1.0,True,True
経済環境変化に応じた重要物資サプライチェーン強靱化支援事業(クラウドプログラム),完全一致,7216,経済環境変化に応じた重要物資サプライチェーン強靱化支援事業(クラウドプログラム),1.0,True,True
生成AIの基盤的な開発力強化に資する計算資源の整備（国立研究開発法人産業技術総合研究所施設整備費補助金）,完全一致,7158,生成AIの基盤的な開発力強化に資する計算資源の整備（国立研究開発法人産業技術総合研究所施設整備費補助金）,1.0,True,True
次世代人工知能・ロボットの中核となるインテグレート技術開発事業,完全一致,3743,次世代人工知能・ロボットの中核となるインテグレート技術開発事業,1.0,True,True
規制改革推進のための国際連携事業,完全一致,3566,規制改革推進のための国際連携事業,1.0,True,True
運輸部門におけるエネルギー使用合理化・非化石エネルギー転換推進事業費補助金,完全一致,7127,運輸部門におけるエネルギー使用合理化・非化石エネルギー転換推進事業費補助金,1.0,True,True
AI・IoT等を活用した更なる輸送効率化推進事業費補助金,完全一致,3965,AI・IoT等を活用した更なる輸送効率化推進事業費補助金,1.0,True,True
経済産業政策に関わる拠出金・分担金事業,完全一致,20591,経済産業政策に関わる拠出金・分担金事業,1.0,True,True
希少金属資源開発推進基盤整備事業,完全一致,3679,希少金属資源開発推進基盤整備事業,1.0,True,True
量子・古典ハイブリッド技術のサイバー・フィジカル開発事業,完全一致,5855,量子・古典ハイブリッド技術のサイバー・フィジカル開発事業,1.0,True,True
イノベーション創出のためのフロンティア育成・基盤構築事業（うち先導研究・懸賞金型事業）,完全一致,3513,イノベーション創出のためのフロンティア育成・基盤構築事業（うち先導研究・懸賞金型事業）,1.0,True,True
Web3.0・ブロックチェーンを活用したデジタル公共財等構築実証事業,完全一致,7150,Web3.0・ブロックチェーンを活用したデジタル公共財等構築実証事業,1.0,True,True
ポスト５Ｇ情報通信システム基盤強化研究開発事業（ロボティクス分野におけるソフトウェア基盤開発構築事業）,完全一致,21007,ポスト５Ｇ情報通信システム基盤強化研究開発事業（ロボティクス分野におけるソフトウェア基盤開発構築事業）,1.0,True,True
量子コンピュータの産業化に向けた環境整備事業,完全一致,20952,量子コンピュータの産業化に向けた環境整備事業,1.0,True,True
デジタル人材育成エコシステム構築事業,完全一致,20946,デジタル人材育成エコシステム構築事業,1.0,True,True
鉱物サプライチェーン多角化・安定化事業,完全一致,20976,鉱物サプライチェーン多角化・安定化事業,1.0,True,True
予防・健康づくり分野における先端技術を活用した社会課題解決サービス開発促進事業事業,完全一致,21002,予防・健康づくり分野における先端技術を活用した社会課題解決サービス開発促進事業事業,1.0,True,True
医療研究開発推進事業費補助金（医療機器・ヘルスケアプロジェクト）（保健衛生医療調査等推進事業費補助金を含む）,完全一致,2959,医療研究開発推進事業費補助金（医療機器・ヘルスケアプロジェクト）（保健衛生医療調査等推進事業費補助金を含む）,1.0,True,True
次世代病院情報システムα版（情報通信技術調達等適正・効率化推進費）,完全一致,20912,次世代病院情報システムα版（情報通信技術調達等適正・効率化推進費）,1.0,True,True
無償資金協力統合管理・分析システム（GIMAS）（情報通信技術調達等適正・効率化推進費）,完全一致,20969,無償資金協力統合管理・分析システム（GIMAS）（情報通信技術調達等適正・効率化推進費）,1.0,True,True
ＡＩ活用による国際法関連業務合理化関係経費,完全一致,6766,ＡＩ活用による国際法関連業務合理化関係経費,1.0,True,True
在外公館及び本省における外部専門家の活用,完全一致,1066,在外公館及び本省における外部専門家の活用,1.0,True,True
アジア欧州財団(ASEF：ASIA-EUROPE FOUNDATION)拠出金（任意拠出金）,完全一致,1234,アジア欧州財団(ASEF：ASIA-EUROPE FOUNDATION)拠出金（任意拠出金）,1.0,True,True
国連ＡＩハイレベル諮問委員会への拠出関係経費,完全一致,7699,国連ＡＩハイレベル諮問委員会への拠出関係経費,1.0,True,True
国際機関評価ネットワーク（ＭＯＰＡＮ）拠出金,完全一致,1308,国際機関評価ネットワーク（ＭＯＰＡＮ）拠出金,1.0,True,False
在外邦人の安全対策に関する情報収集と官民連携,完全一致,1092,在外邦人の安全対策に関する情報収集と官民連携,1.0,True,True
国際連合開発計画（ＵＮＤＰ）拠出金（日本・パレスチナ開発基金）,完全一致,1287,国際連合開発計画（ＵＮＤＰ）拠出金（日本・パレスチナ開発基金）,1.0,True,False
カルテット拠出金,完全一致,6685,カルテット拠出金,1.0,True,False
海外科学技術動向調査,完全一致,20603,海外科学技術動向調査,1.0,True,True
国際司法・法の支配研究所拠出金,完全一致,20805,国際司法・法の支配研究所拠出金,1.0,True,True
大学等の海外留学支援制度,完全一致,1857,大学等の海外留学支援制度,1.0,True,False
生産現場における水産業のスマート化の推進,完全一致,7780,生産現場における水産業のスマート化の推進,1.0,True,True
国際開発教育・研究機関拠出金（任意拠出金）,完全一致,1296,国際開発教育・研究機関拠出金（任意拠出金）,1.0,True,False
地域の持続的発展のための中小商業者等の機能活性化事業,完全一致,3951,地域の持続的発展のための中小商業者等の機能活性化事業,1.0,True,True
5G等の活用による製造業のダイナミック・ケイパビリティ強化に向けた研究開発事業,完全一致,3953,5G等の活用による製造業のダイナミック・ケイパビリティ強化に向けた研究開発事業,1.0,True,True
